key,ability,ability_name,description,tooltip,maxrank,cooldown,cost,maxammo,range
62,W,Warrior Trickster,"Wukong becomes <font color='#91d7ee'>Invisible</font> and dashes in a direction, leaving behind a clone that will attack nearby enemies.","Wukong dashes and becomes <keywordStealth>Invisible</keywordStealth> for {{ stealthduration }} second, leaving behind a stationary <keywordMajor>Clone</keywordMajor> for {{ cloneduration }} seconds.<br /><br />The <keywordMajor>Clone</keywordMajor> Attacks nearby enemies Wukong has recently damaged and will mimic his ultimate, each dealing {{ clonedamagemod*100 }}% of normal damage.",5,20_19_18_17_16,80_70_60_50_40,-1,275
62,E,Nimbus Strike,"Wukong dashes to a targeted enemy and sends out images to attack enemies near his target, dealing damage to each enemy struck.","Wukong dashes to an enemy, sending out <keywordMajor>Clones</keywordMajor> that mimic the dash to up to {{ extratargets }} additional enemies nearby. Each enemy struck takes <magicDamage>{{ totaldamage }} magic damage</magicDamage>. He and his <keywordMajor>Clone</keywordMajor> gain <attackSpeed>{{ attackspeed*100 }}% Attack Speed</attackSpeed> for {{ attackspeedduration }} seconds.<br /><br /><rules><span class=""color8c8c8c"">Deals {{ totaldamagemonsters }} damage to monsters.</span></rules>",5,10_9.5_9_8.5_8,30_35_40_45_50,-1,650
62,R,Cyclone,"Wukong's extends his staff and spins it around repeatedly, gaining Movement Speed.<br><br>Enemies struck take damage and are knocked up.","Wukong gains <speed>{{ movespeed*100 }}% Move Speed</speed> and spins his staff, <status>Knocking Up</status> nearby enemies for {{ knockupduration }} seconds and take <physicalDamage>{{ totaldamagett }} plus {{ percenthpdamagett }} max Health physical damage</physicalDamage> over {{ spinduration }} seconds.<br /><br />This Ability can be cast a second time within {{ recastwindow }} seconds before going on cooldown.",3,120_105_90,100_100_100,-1,315
82,Q,Obliterate,Mordekaiser smashes the ground with his mace dealing damage to each enemy struck. Damage is increased when hitting a single enemy.,"Mordekaiser smashes the ground with Nightfall dealing <magicDamage>{{ qdamage }} magic damage</magicDamage>, increased to <magicDamage>{{ empowereddamagetooltip }}</magicDamage> if it hits only a single enemy.",5,9_7.75_6.5_5.25_4,0_0_0_0_0,-1,675
82,W,Indestructible,Mordekaiser stores damage he deals and takes to create a shield. He may consume the shield to heal.,<passive>Passive:</passive> Mordekaiser stores {{ damageconversion*100 }}% of the damage he deals and {{ damagetakenconversion*100 }}% of the damage he takes.<br /><br /><active>Active:</active> Mordekaiser gains the stored damage as <shield>Shield</shield>. He may <recast>Recast</recast> this Ability to restore <healing>{{ healingpercent*100 }}% of the remaining Shield as Health</healing>.<br /><br />Minimum Shield: <shield>{{ minhealthtooltip }}</shield><br />Maximum Shield: <shield>{{ maxhealthtooltip }}</shield>,5,12_11_10_9_8,0_0_0_0_0,-1,25000
82,E,Death's Grasp,Mordekaiser pulls all enemies in an area.,"<spellPassive>Passive:</spellPassive> Mordekaiser gains {{ magicpen*100 }}% Magic Penetration.<br /><br /><spellActive>Active:</spellActive> Mordekaiser pulls enemies in his direction, dealing <magicDamage>{{ totaldamage }} magic damage.</magicDamage>",5,18_16_14_12_10,0_0_0_0_0,-1,700
82,R,Realm of Death,"Mordekaiser drags his victim to a different dimension with him and steals a portion of their stats. If he kills them, he keeps the stats until the victim respawns.","Mordekaiser banishes a champion to the Death Realm with him for {{ spiritrealmduration }}s, stealing {{ statstealpercentscalar*100 }}% of their core stats for the duration.<br /><br />If Mordekaiser kills that enemy in the Death Realm he consumes their soul, keeping the stats he stole until the target respawns.",3,140_120_100,0_0_0,-1,650
25,Q,Dark Binding,"Morgana binds an enemy in place with dark magic, forcing them to feel the pain they've caused and dealing magic damage. ",Morgana hurls a blast of starfire that <status>Roots</status> the first enemy hit for {{ rootduration }} seconds and deals <magicDamage>{{ totaldamage }} magic damage</magicDamage>.,5,10_10_10_10_10,50_55_60_65_70,-1,1250
25,W,Tormented Shadow,"Morgana casts a cursed shadow on an area, damaging enemies who dare stand in her dark circle. They receive magic damage over time, which increases the lower health they are.","Morgana ignites the ground for {{ wduration }} seconds, dealing <magicDamage>{{ totalmindamage }} magic damage</magicDamage> per second, increased by up to {{ missinghealthamppercent*100 }}% based on the targets' percentage missing health.<br /><br />This Ability's Cooldown is reduced by {{ cdrefundpercent*100 }}% every time Morgana is healed by <spellName>Soul Siphon</spellName>.",5,12_12_12_12_12,70_85_100_115_130,-1,900
25,E,Black Shield,"Morgana anoints an ally with a protective barrier of starfire, which absorbs magical damage and disabling effects until it is broken.",Morgana grants an ally champion <shield>{{ totalshieldstrength }} Magic Shield</shield> for {{ shieldduration }} seconds. The shield prevents <status>Disabling</status> and <status>Immobilizing</status> effects until it breaks.,5,24_22_20_18_16,80_80_80_80_80,-1,800
25,R,Soul Shackles,"Morgana unleashes the full force of her Celestial power as she unbinds her wings and hovers above the ground. She lashes chains of dark pain onto nearby enemy champions, gaining Move Speed towards them. The chains slow and deal initial damage and, after a delay, stun those who are unable to break them.","Morgana chains herself to nearby enemy Champions, dealing <magicDamage>{{ totaldamage }} magic damage</magicDamage> and <status>Slowing</status> them by {{ slowpercent }}%. After {{ chainduration }} seconds, enemies unable to break the chains take an additional <magicDamage>{{ totaldamage }} magic damage</magicDamage> and are <status>Stunned</status> for {{ stunduration }} seconds.<br /><br />While casting this Ability, Morgana gains <speed>{{ hastepercent }}% Move Speed</speed> towards enemies she has chained.",3,120_110_100,100_100_100,-1,625
267,Q,Aqua Prison,"Sends a bubble to a target area, dealing damage and stunning all enemies on impact.","Nami hurls a bubble, <status>Stunning</status> for {{ e2 }} seconds and dealing <magicDamage>{{ totaldamagett }} magic damage</magicDamage>.",5,12_11_10_9_8,60_60_60_60_60,-1,875
267,W,Ebb and Flow,"Unleashes a stream of water that bounces back and forth between allied and enemy champions, healing allies and damaging enemies.","Nami unleashes a stream of water that bounces between allied and enemy champions. Each champion can only be hit once, and it hits up to {{ e2 }} targets.<li>Restores <healing>{{ totalhealtooltip }} Health</healing> to allies and will bounce to a nearby enemy champion. <li>Deals <magicDamage>{{ totaldamagetooltip }} magic damage</magicDamage> to enemies and will bounce to a nearby allied champion.<br />The damage and healing value is modified by {{ bouncescalingtooltip }} each bounce. ",5,10_10_10_10_10,70_80_90_100_110,-1,725
267,E,Tidecaller's Blessing,Empowers an allied champion for a short duration. The ally's basic attacks and spells deal bonus magic damage and slow the target.,"Nami empowers an allied champion's next {{ e4 }} Attacks and Abilities for {{ e5 }} seconds, causing them to <status>Slow</status> their targets by {{ totalslowtooltip }} for {{ e3 }} second and deal an additional <magicDamage>{{ totaldamagetooltip }} magic damage</magicDamage>. ",5,11_11_11_11_11,55_60_65_70_75,-1,800
267,R,Tidal Wave,"Summons a massive Tidal Wave that knocks up, slows, and damages enemies. Allies hit gain double the effect of Surging Tides.","Nami summons a tidal wave, <status>Knocking Up</status> for 0.5 seconds, <status>Slowing</status> by {{ e4 }}%, and dealing <magicDamage>{{ totaldamagetooltip }} magic damage</magicDamage>. The duration of the <status>Slow</status> increases based on distance the wave traveled, up to {{ e5 }} seconds.<br /><br />Allies hit by the wave gain double the effect of <spellName>Surging Tides</spellName>.",3,120_110_100,100_100_100,-1,2550
75,Q,Siphoning Strike,"Nasus strikes his foe, dealing damage and increasing the power of his future Siphoning Strikes if he slays his target.","Nasus' next Attack deals <physicalDamage>{{ totaldamage }} physical damage</physicalDamage>. Killing an enemy with this Attack permanently increases its damage by {{ e2 }}, increased to {{ e4 }} against champions, large minions and large jungle monsters.<br /><br /><rules>This Ability triggers spell effects upon dealing damage.</rules>",5,7.5_6.5_5.5_4.5_3.5,20_20_20_20_20,-1,300
75,W,Wither,"Nasus ages an enemy champion, decelerating their Move Speed and Attack Speed over time.","Nasus ages a champion, <status>Slowing</status> them by {{ e2 }}%, increasing to {{ e1 }}% over {{ e3 }} seconds. Their Attack Speed is also reduced by 50% of the <status>Slow</status>.",5,15_14_13_12_11,80_80_80_80_80,-1,700
75,E,Spirit Fire,"Nasus unleashes a spirit flame at a location, dealing damage and reducing the Armor of enemies who stand on it.","Nasus ignites a spirit flame, dealing <magicDamage>{{ initialdamage }} magic damage</magicDamage>. Enemies in the area lose <scaleArmor>{{ e2 }}% Armor</scaleArmor> and take <magicDamage>{{ totaldotdamage }} magic damage</magicDamage> over {{ e3 }} seconds.",5,12_12_12_12_12,70_85_100_115_130,-1,650
75,R,Fury of the Sands,"Nasus unleashes a mighty sandstorm that batters nearby enemies. While the storm rages, he gains increased Health, Attack Range, damages nearby enemies, has a reduced cooldown on Siphoning Strike, and gains bonus Armor and Magic Resistance.","Nasus becomes empowered in the sandstorm for 15 seconds, increasing his <healing>maximum Health by {{ bonushealth }}</healing> and <scaleArmor>Armor</scaleArmor> and <scaleMR>Magic Resistance</scaleMR> by {{ initialresistgain }}.<br /><br />While the storm rages, nearby enemies take <magicDamage>{{ damagecalc }} of their maximum Health as magic damage</magicDamage> each second and <spellName>Siphoning Strike</spellName> has a {{ qcdr*100 }}% reduced Cooldown.",3,120_120_120,100_100_100,-1,20
111,Q,Dredge Line,"Nautilus hurls his anchor forward.  Colliding with an enemy pulls them and Nautilus together, dealing magic damage.  Colliding with terrain pulls Nautilus towards it.","Nautilus hurls his anchor forward. If it hits an enemy, Nautilus drags himself and the target together, dealing <magicDamage>{{ qdamagecalc }} magic damage</magicDamage> and <status>Stunning</status> them briefly. If the anchor hits terrain, Nautilus will drag himself towards it.",5,14_13_12_11_10,60_60_60_60_60,-1,1150
111,W,Titan's Wrath,"Nautilus gains a temporary Shield.  While it persists, his Attacks deal damage over time to his target and surrounding enemies.","Nautilus gains a <shield>{{ shieldcalc }} Shield</shield> for {{ shieldduration }} seconds. While the <shield>Shield</shield> persists, Nautilus' Attacks deal an additional <magicDamage>{{ dotdamagecalc }} magic damage</magicDamage> over 2 seconds to his target and all surrounding enemies.",5,12_12_12_12_12,80_80_80_80_80,-1,350
111,E,Riptide,Nautilus creates three exploding waves around himself. Each explosion damages and slows enemies.,"Nautilus creates three exploding waves around himself, each dealing <magicDamage>{{ damagecalc }} magic damage</magicDamage> to enemies in the area and <status>Slows</status> them by {{ slowpercent*100 }}% decaying over {{ slowduration }} seconds.",5,7_6.5_6_5.5_5,50_60_70_80_90,-1,600
111,R,Depth Charge,"Nautilus fires a shockwave into the earth that chases an opponent. This shockwave rips up the earth above it, knocking enemies into the air. When it reaches the opponent, the shockwave erupts, knocking his target into the air and stunning them.","Nautilus fires a shockwave that chases an enemy champion, dealing <magicDamage>{{ primarytargetdamage }} magic damage</magicDamage>, <status>Knocking</status> them <status>Up</status> and <status>Stunning</status> them for {{ stunduration }} seconds. Other enemies hit by the shockwave are also <status>Knocked Up</status> and <status>Stunned</status> and take <magicDamage>{{ secondarytargetdamage }} magic damage</magicDamage>.",3,120_100_80,100_100_100,-1,825
518,Q,Blooming Burst,Neeko throws a seed dealing magic damage. The seed blooms again on hitting champions or killing units.,"Neeko throws a seed that blooms to deal {{ explosiondamage }} magic damage. If it kills a unit or hits a champion or large monster, it will bloom again, dealing {{ seconddamage }} magic damage. Max 2 extra blooms.",5,7_7_7_7_7,50_60_70_80_90,-1,800
518,W,Shapesplitter,Neeko passively deals bonus magic damage every third attack. Neeko can activate to send a clone in a direction.,"<span class=""colorFF9900"">Passive:</span> Every 3rd attack deals {{ passivebonusdamagecalc }} bonus magic damage and increases Neeko's Movement Speed by {{ passivehaste }}% for {{ passivehasteduration }} second.<br /><br /><span class=""colorFF9900"">Active:</span> Neeko becomes invisible for {{ stealthduration }} seconds and projects a clone that lasts {{ cloneduration }} seconds. Neeko and the clone gain {{ haste }}% Movement Speed for {{ hasteduration }} seconds.",5,20_19_18_17_16,0_0_0_0_0,-1,900
518,E,Tangle-Barbs,"Neeko slings a tangle that damage and root everything it passes through. If the tangle kills an enemy or passes through a champion, it becomes larger, faster, and roots for longer.","Neeko slings a tangle that deals {{ basedamage }} magic damage and roots for {{ minrootduration }} seconds.<br /><br />The tangle becomes empowered after hitting an enemy, growing larger, moving faster, and rooting for {{ maxrootduration }} seconds.",5,12_11.5_11_10.5_10,60_65_70_75_80,-1,1000
518,R,Pop Blossom,"After a short preparation, Neeko leaps into the air and gains a shield. Upon landing, nearby enemies are damaged and stunned. The preparation is hidden if Neeko is disguised.",After {{ delayuntilreveal }} seconds Neeko leaps into the air. She gains a shield that absorbs {{ baseshield }} damage (+{{ shieldmultiplier }} for each nearby enemy champion).<br /><br />When Neeko lands she deals {{ totaldamage }} magic damage and stuns nearby enemies for {{ ccduration }} seconds.<br /><br />This ability can be prepared in secret if Neeko is disguised.,3,90_90_90,100_100_100,-1,600
76,Q,Javelin Toss / Takedown,"In human form, Nidalee throws a spiked javelin at her target that gains damage as it flies.  As a cougar, her next attack will attempt to fatally wound her target, dealing more damage the less life they have.","<keywordMajor>Human Form:</keywordMajor> Nidalee throws her javelin, dealing <magicDamage>{{ humanminimumdamage }} magic damage</magicDamage>, increased up to <magicDamage>{{ humanmaximumdamage }} magic damage</magicDamage> based on distance flown.",5,6_6_6_6_6,50_55_60_65_70,-1,1500
76,W,Bushwhack / Pounce,"In human form, Nidalee lays a trap for unwary opponents that, when sprung, damages and reveals its target. As a cougar, she jumps in a direction, dealing damage in an area where she lands.","<keywordMajor>Human Form:</keywordMajor> Nidalee places an invisible trap for 2 minutes. When an enemy walks over it, they are dealt <magicDamage>{{ damagepersecond }} magic damage</magicDamage> per second for {{ e3 }} seconds.<br /><br />{{ maxtraps }} traps may be active at once.",5,13_12_11_10_9,40_45_50_55_60,0,900
76,E,Primal Surge / Swipe,"In human form, Nidalee channels the spirit of the cougar to heal her allies and imbue them with Attack Speed for a short duration. As a cougar, she claws in a direction, dealing damage to enemies in front of her.",<keywordMajor>Human Form:</keywordMajor> Nidalee restores <healing>{{ totalhealing }} Health</healing> plus 1% per 1% missing Health and grants them <attackSpeed>{{ e4 }}% Attack Speed</attackSpeed> for 7 seconds.,5,12_12_12_12_12,50_60_70_80_90,-1,600
76,R,Aspect Of The Cougar,"Nidalee transforms into a cougar, gaining new abilities.","<spellPassive>Passive:</spellPassive> While in <keywordMajor>Human Form</keywordMajor>, applying <keywordMajor>Hunted</keywordMajor> refreshes this Ability's Cooldown.<br /><br /><keywordMajor>Human Form:</keywordMajor> Nidalee transforms into <keywordMajor>Cougar Form</keywordMajor>, gaining melee Attacks and replacing her Active Abilities.<br /><br /><keywordMajor>Cougar Form:</keywordMajor> Nidalee transforms into <keywordMajor>Human Form</keywordMajor>, gaining ranged Attacks and replacing her Active Abilities.",4,3_3_3_3,0_0_0_0,-1,20
56,Q,Duskbringer,"Nocturne throws a shadow blade that deals damage, leaves a Dusk Trail, and causes champions to leave a Dusk Trail. While on the trail, Nocturne can move through units and has increased Movement Speed and Attack Damage.","Nocturne throws a shadow blade, dealing <physicalDamage>{{ totaldamage }} physical damage</physicalDamage> and leaving a dusk trail for {{ e3 }} seconds. Enemy champions hit also leave a trail. <br /><br />While on the trail, Nocturne is Ghosted and gains <speed>{{ e1 }}% Move Speed</speed> and <physicalDamage>{{ e4 }} Attack Damage</physicalDamage>.",5,8_8_8_8_8,60_65_70_75_80,-1,1125
56,W,Shroud of Darkness,"Nocturne empowers his blades, passively gaining Attack Speed. Activating Shroud of Darkness allows Nocturne to fade into the shadows, creating a magical barrier which blocks a single enemy ability and doubles his passive Attack Speed if successful.","<spellPassive>Passive:</spellPassive> Nocturne gains <attackSpeed>{{ e1 }}% Attack Speed</attackSpeed>.<br /><br /><spellActive>Active:</spellActive> Nocturne creates a shadow barrier for 1.5 seconds that blocks the next enemy Ability. If an Ability is blocked, this Ability's passive effect is increased to <attackSpeed>{{ e1 }}% Attack Speed</attackSpeed> for {{ e4 }} seconds.",5,20_18_16_14_12,50_50_50_50_50,-1,20
56,E,Unspeakable Horror,"Nocturne plants a nightmare into his target's mind, dealing damage each second and applying fear to the target if they do not get out of range by the end of the duration.","<spellPassive>Passive:</spellPassive> Nocturne gains <speed>{{ tooltipfearms*100 }}% Move Speed</speed> toward <status>Feared</status> enemies.<br /><br /><spellActive>Active:</spellActive> Nocturne plants a nightmare tether into his target, dealing <magicDamage>{{ totaldamage }} magic damage</magicDamage> over {{ e3 }} seconds. If the tether remains unbroken, the target is <status>Feared</status> for {{ e2 }} second(s).",5,15_14_13_12_11,60_65_70_75_80,-1,425
56,R,Paranoia,Nocturne reduces the sight radius of all enemy champions and removes their ally vision in the process. He can then launch himself at a nearby enemy champion.,"Nocturne darkens the map, reducing the sight radius and removing ally vision of enemy champions for {{ paranoiaduration }} seconds. Nocturne can <recast>Recast</recast> this Ability during the duration to launch himself at an enemy champion dealing <physicalDamage>{{ damage }} physical damage</physicalDamage>.",3,140_115_90,100_100_100,-1,2500/3250/4000
20,Q,Consume,"Willump takes a bite out of a minion, monster, or enemy champion, dealing damage and healing himself.","Nunu asks Willump to take a bite of an enemy, dealing <trueDamage>{{ monsterminiondamage }} true damage</trueDamage> and restoring <healing>{{ monsterhealing }} Health</healing> when used against a minion or jungle monster. Against a champion, it instead deals <magicDamage>{{ totalchampiondamage }} magic damage</magicDamage> and restores <healing>{{ championhealing }} Health</healing>.<br /><br />The <healing>healing</healing> is increased by {{ lowhealthhealingscalar*100 }}% when Nunu and Willump are below {{ lowhealththreshhold*100 }}% Health.",5,12_11_10_9_8,60_60_60_60_60,-1,125
20,W,Biggest Snowball Ever!,Willump creates a snowball that grows in size and speed as he rolls it.  The snowball damages and knocks up enemies.,"Nunu and Willump create a snowball that grows in size and speed as they roll it. They turn slower while rolling it, but can increase turning speed by holding the turn.<br /><br />The snowball does between <magicDamage>{{ noimpactsnowballdamage }}</magicDamage> and <magicDamage>{{ maximumsnowballdamage }} magic damage</magicDamage>, and <status>Knocks Up</status> for between {{ baseknockupduration }} and {{ maximumstunduration }} seconds when it collides with a champion, large monster or wall. These values scale up with distance rolled.<br /><br />Nunu and Willump can <recast>Recast</recast> to let the snowball go early.",5,14_14_14_14_14,50_55_60_65_70,-1,7500
20,E,Snowball Barrage,"Nunu throws multiple snowballs that damage enemies.  When he's finished, Willump roots any champions or large monsters that were hit by a snowball.","Nunu throws three snowballs, dealing a total of <magicDamage>{{ totalsnowballdamage }} magic damage</magicDamage> per snowball and <status>Slowing</status> enemies hit by all three by {{ slowamount*-100 }}% for {{ slowduration }} seconds. Nunu can <recast>Recast</recast> this up to twice more.<br /><br />After {{ totalspellduration }} seconds, Nunu <status>Roots</status> all nearby enemies that had been <status>Slowed</status> by the snowballs for {{ rootduration }} seconds and deals an additional <magicDamage>{{ totalrootdamage }} magic damage</magicDamage>.",5,14_14_14_14_14,50_55_60_65_70,-1,625
20,R,Absolute Zero,Nunu & Willump create a powerful blizzard in an area that slows enemies and deals massive damage at the end.,"Nunu and Willump channel a powerful blizzard for up to {{ channelduration }} seconds. Enemies inside are <status>Slowed</status> by {{ slowstartamount*-100 }}%, increasing to {{ maxslowamount*-100 }}% over the duration. Nunu and Willump also gain <shield>{{ totalshieldamount }} Shield</shield> for the duration before decaying over {{ shielddecayduration }} seconds afterwards.<br /><br />When the blizzard ends, it detonates, dealing between <magicDamage>{{ mindamage }}</magicDamage> and <magicDamage>{{ maximumdamage }} magic damage</magicDamage> based on channel time. Nunu and Willump can <recast>Recast</recast> to end the blizzard early.",3,110_100_90,100_100_100,-1,650
2,Q,Undertow,"Olaf throws an axe into the ground at a target location, dealing damage to enemies it passes through and slowing their Move Speed. If Olaf picks up the axe, the ability's cooldown is reduced by 4.5 seconds.","Olaf throws an axe, dealing <physicalDamage>{{ totaldamage }} physical damage</physicalDamage> and <status>Slowing</status> by {{ e2 }}% for between {{ e4 }} and {{ e3 }} seconds, based on distance travelled.<br /><br />If Olaf picks up the axe, this Ability's Cooldown is reduced by 4.5 seconds.",5,7_7_7_7_7,60_60_60_60_60,-1,1000
2,W,Vicious Strikes,"Olaf's Attack Speed is increased, he gains Life Steal and has increased healing from all sources based on how much Health he is missing.","For {{ duration }} seconds, Olaf gains <lifeSteal>{{ lifesteal*100 }}% Life Steal</lifeSteal>, <attackSpeed>{{ attackspeed*100 }}% Attack Speed</attackSpeed>, and increases healing received by up to <healing>{{ healingampmax*100 }}% (based on missing Health)</healing>.",5,16_16_16_16_16,30_30_30_30_30,-1,700
2,E,Reckless Swing,"Olaf attacks with such force that it deals true damage to his target and himself, refunding the Health cost if he destroys the target.","Olaf ferociously swings his axes, dealing <trueDamage>{{ totaldamage }} true damage</trueDamage>. If the enemy dies, the cost is refunded.<br /><br />Attacks lower the Cooldown of this Ability by 1 second.",5,11_10_9_8_7,0_0_0_0_0,-1,325
2,R,Ragnarok,Olaf temporarily becomes immune to disables.,"<spellPassive>Passive: </spellPassive>Olaf gains <scaleArmor>{{ resists }} Armor</scaleArmor> and <scaleMR>{{ resists }} Magic Resist</scaleMR>.<br /><br /><spellActive>Active: </spellActive>Olaf ends all <status>Immobilizing</status> and <status>Disabling</status> effects on himself and can't be affected by them for the next {{ duration }} seconds. While active, Olaf loses this Ability's <scaleArmor>Armor</scaleArmor> and <scaleMR>Magic Resist</scaleMR> and instead gains <scaleAD>{{ ad }} Attack Damage</scaleAD>. Olaf also gains <speed>{{ haste*100 }}% Move Speed</speed> towards enemy champions for {{ hasteduration }} second.",3,100_90_80,0_0_0,-1,400
61,Q,Command: Attack,"Orianna commands her Ball to fire toward a target location, dealing magic damage to targets along the way (deals less damage to subsequent targets). Her Ball remains at the target location after.","Orianna commands her <keywordMajor>Ball</keywordMajor> to move to an area, dealing <magicDamage>{{ totaldamagetooltip }} magic damage</magicDamage> to surrounding enemies and to enemies it passes through. Deals {{ e2 }}% less damage per enemy hit.",5,6_5.25_4.5_3.75_3,30_35_40_45_50,-1,815
61,W,Command: Dissonance,"Orianna commands her Ball to release a pulse of energy, dealing magic damage around it. This leaves a field behind that speeds up allies and slows enemies.","Orianna commands her <keywordMajor>Ball</keywordMajor> to release an electric pulse, dealing <magicDamage>{{ totaldamage }} magic damage</magicDamage> to surrounding enemies.<br /><br />The pulse leaves behind an energy field for {{ fieldduration }} seconds, <status>Slowing</status> enemies by {{ slowamount*100 }}% and granting allies <speed>{{ hasteamount*100 }}% Move Speed</speed>, decaying over {{ slowandhasteduration }} seconds.",5,7_7_7_7_7,70_80_90_100_110,-1,255
