key,ability,ability_name,description,tooltip,maxrank,cooldown,cost,maxammo,range
875,W,Haymaker,"Sett passively stores damage he takes as Grit. On cast, Sett expends all stored Grit to gain a shield and punch an area, dealing true damage in the center and physical damage on the sides.","<spellPassive>Passive:</spellPassive> Sett stores {{ damagestored*100 }}% of damage taken as <keywordMajor>Grit</keywordMajor>, up to <keywordMajor>{{ maxgrit }}</keywordMajor>. <keywordMajor>Grit</keywordMajor> decays quickly {{ adrenalinestoragewindow }} seconds after the damage was taken.<br /><br /><spellActive>Active:</spellActive> Sett consumes all <keywordMajor>Grit</keywordMajor>, gaining a <shield>{{ shieldconversion*100 }}% Grit consumed Shield</shield> decaying over {{ shieldmaxduration }} seconds. Sett then delivers a massive punch, dealing <trueDamage>{{ damagecalc }} plus {{ damageconversion }} Grit consumed true damage</trueDamage> to enemies in the center (max <trueDamage>{{ f1 }} damage</trueDamage>). Enemies not in the center instead take <physicalDamage>physical damage</physicalDamage>.",5,18_16.5_15_13.5_12,0_0_0_0_0,-1,25000
875,E,Facebreaker,"Sett pulls in all enemies on opposite sides of him, dealing damage and stunning them. If enemies were only on one side, they are slowed instead of stunned.","Sett smashes enemies on either side of him into each other, dealing <physicalDamage>{{ damagecalc }} physical damage</physicalDamage> and <status>Slowing</status> them by {{ slowamount*100 }}% for {{ slowduration }} seconds. If Sett grabbed at least one enemy on each side, all enemies are <status>Stunned</status> for {{ stunduration }} second.",5,16_14.5_13_11.5_10,0_0_0_0_0,-1,490
875,R,The Show Stopper,"Sett carries an enemy champion through the air and slams them into the ground, dealing damage and slowing all enemies near where they land.","Sett grabs an enemy champion and <status>Suppresses</status> them as he carries them forward, then slams them into the ground, dealing <physicalDamage>{{ damagecalc }} plus {{ maxhealthdamage*100 }}% of the grabbed enemy's bonus Health physical damage</physicalDamage> to surrounding enemies and <status>Slowing</status> them by {{ slowamount*100 }}% for {{ slowduration }} second. Enemies take less damage the further they are from where Sett lands.",3,120_100_80,0_0_0,-1,400
35,Q,Deceive,"Shaco becomes Invisible and teleports to target location.<br><br>His first attack while Invisible is empowered, dealing bonus damage and critically striking if he attacks from behind.","Shaco teleports and becomes <keywordStealth>Invisible</keywordStealth> for {{ stealthduration }} seconds. Using <spellName>Jack In The Box</spellName> or <spellName>Hallucinate</spellName> does not break <keywordStealth>Invisibility</keywordStealth>.<br /><br />Shaco's next Attack while <keywordStealth>Invisible</keywordStealth> deals an additional <physicalDamage>{{ totaldamage }} physical damage</physicalDamage>. If striking from behind, this Attack critically strikes for {{ qcritdamagemod }} damage.",5,12_11.5_11_10.5_10,60_60_60_60_60,-1,400
35,W,Jack In The Box,"Shaco creates a hidden animated Jack-in-the-Box. When triggered, it will fear and attack nearby enemies.","Shaco creates a trap that stealths itself after {{ e5 }} seconds and lasts for {{ trapduration }} seconds. It activates when an enemy comes near or when revealed, <status>Fearing</status> nearby enemy Champions for {{ e3 }} seconds, or {{ minionfearduration }} seconds for minions and jungle monsters.<br /><br />Once activated, the trap fires at all nearby enemies for 5 seconds, dealing <magicDamage>{{ aoedamage }} magic damage</magicDamage>, or <magicDamage>{{ stdamage }} damage</magicDamage> if focused on a single target.<br /><br />Jack in the Box's attacks deal an additional <magicDamage>{{ monsterbonusdamage }}</magicDamage> damage to monsters.",5,16_16_16_16_16,50_55_60_65_70,-1,500
35,E,Two-Shiv Poison,"Shaco's Shivs passively poison targets on hit, slowing their movement speed. He can throw his Shivs to deal damage and poison the target. The thrown Shiv deals bonus damage if the target is below 30% health.","<spellPassive>Passive:</spellPassive> While this Ability is off Cooldown, Shaco's Attacks <status>Slow</status> the target by {{ slowamount*-100 }}% for {{ slowdurationpassive }} seconds.<br /><br /><spellActive>Active:</spellActive> Shaco throws a shiv, dealing <magicDamage>{{ totaldamage }} magic damage</magicDamage> and <status>Slowing</status> by {{ slowamount*-100 }}% for {{ slowdurationactive }} seconds. If the target has less than {{ executehealththreshold*100 }}% Health, the shiv deals <magicDamage>{{ totalexecutedamage }} damage</magicDamage> instead.",5,8_8_8_8_8,65_65_65_65_65,-1,625
35,R,Hallucinate,"Shaco creates an illusion of himself near him, which can attack nearby enemies (Deals reduced damage to turrets).  Upon death, it explodes, spawning three mini Jack in the Boxes and dealing damage to nearby enemies.","Shaco briefly disappears, then reappears with a clone that lasts {{ clonelifetime }} seconds and detonates when it dies, dealing <magicDamage>{{ explosiontotaldamage }} magic damage</magicDamage> and spawning three mini <spellName>Jack in the Boxes</spellName> that trigger immediately. The clone deals {{ cloneaadamagepercent*100 }}% of Shaco's damage and receives {{ cloneincomingdamagepercent*100 }}% increased damage.<br /><br />Mini <spellName>Jack in the Boxes</spellName> deal <magicDamage>{{ aoedamage }} magic damage</magicDamage>, or <magicDamage>{{ stdamage }} magic damage</magicDamage> if firing at only one enemy, and <status>Fear</status> for {{ boxfearduration }} second(s).<br />",3,100_90_80,100_100_100,-1,200
98,Q,Twilight Assault,"Shen recalls his spirit blade to attack with it, dealing damage based on the target's max health. The attacks are greatly empowered if it collides with an enemy champion, and all collided enemies are slowed while running away from Shen.","Shen recalls his <keywordMajor>Spirit Blade</keywordMajor>. Enemies hit by the pull are <status>Slowed</status> by {{ e4 }}% while moving away from Shen for the next {{ e5 }} seconds.<br /><br />Additionally, Shen's next {{ e3 }} Attacks deal an additional <magicDamage>{{ baseflatdamage }}</magicDamage> plus <magicDamage>{{ basepercenthealth }} max Health magic damage</magicDamage>. If Shen hit an enemy champion with the <keywordMajor>Spirit Blade</keywordMajor>, the damage is increased to <magicDamage>{{ baseflatdamage }}</magicDamage> plus <magicDamage>{{ emppercenthealth }} max Health magic damage</magicDamage> and he gains <attackSpeed>{{ e9 }}% Attack Speed</attackSpeed> for those Attacks.",5,8_7.25_6.5_5.75_5,140_130_120_110_100,-1,400
98,W,Spirit's Refuge,Attacks that would hit Shen or his allies near his spirit blade are blocked.,"Shen creates a defensive zone at his <keywordMajor>Spirit Blade</keywordMajor> for {{ e1 }} seconds. Attacks against allied champions in the zone are blocked. <br /><br />If there are no champions to protect in the zone when it starts, it will wait for up to {{ e2 }} seconds.",5,18_16.5_15_13.5_11,40_40_40_40_40,-1,400
98,E,Shadow Dash,"Shen dashes in a direction, taunting enemies in his path.","<spellPassive>Passive:</spellPassive> Dealing damage with <spellName>Twilight Assault</spellName> or this Ability recovers <keywordMajor>{{ energyrefund }} Energy</keywordMajor>.<br /><br /><spellActive>Active:</spellActive> Shen dashes, <status>Taunting</status> champions and jungle monsters for {{ ccduration }} seconds and dealing <physicalDamage>{{ tauntdamage }} physical damage</physicalDamage>.",5,18_16_14_12_10,150_150_150_150_150,-1,600
98,R,Stand United,"Shen shields target allied champion from incoming damage, and soon after teleports to their location.","Shen grants an allied champion anywhere on the map between <shield>{{ shield }}</shield> and <shield>{{ maxshield }} Shield</shield> based on their missing Health for {{ shieldduration }} seconds (max Shield at 60% missing Health). After channeling for {{ channelduration }} seconds, Shen teleports to his ally's location with his <keywordMajor>Spirit Blade</keywordMajor>.",3,200_180_160,0_0_0,-1,35000
102,Q,Twin Bite,Shyvana strikes twice on her next attack. Basic attacks reduce the cooldown of Twin Bite by 0.5 seconds.<br><br><font color='#FF3300'>Dragon Form: </font>Twin Bite cleaves all units in front of Shyvana.,"Shyvana's next Attack strikes twice, dealing <physicalDamage>{{ firsthitdamagecalc }}</physicalDamage> then <physicalDamage>{{ secondhitdamagecalc }} physical damage</physicalDamage>.<br /><br />Attacks reduce this Ability's Cooldown by {{ cdreductiononhit }} seconds.<br /><br /><keywordMajor>Dragon Form:</keywordMajor> The empowered Attacks hit all units in front of Shyvana.<br /><br /><rules>This Ability triggers spell effects upon dealing damage.</rules>",5,7_6.5_6_5.5_5,0_0_0_0_0,-1,650
102,W,Burnout,"Shyvana surrounds herself in fire, dealing magic damage per second to nearby enemies and moving faster for 3 seconds, part of this damage is applied again when Shyvana basic attacks an enemy with Burnout active. The Movement Speed reduces over the duration of the spell. Basic attacks extend the duration of Burnout. <br><br><font color='#FF3300'>Dragon Form: </font>Burnout grows in size.","Shyvana summons a flame storm around her, gaining <speed>{{ finalmsperc }} decaying Move Speed</speed> and dealing <magicDamage>{{ damagepertickcalc }} magic damage per second</magicDamage> for {{ baseduration }} seconds. <br /><br />The flame storm also causes Shyvana's Attacks to deal an additional <magicDamage>{{ damageonhitcalc }} magic damage</magicDamage> to surrounding enemies and extend this Ability's duration by {{ bonusdurationonhit }} second.<br /><br /><keywordMajor>Dragon Form:</keywordMajor> The size of the flame storm is increased.",5,12_12_12_12_12,0_0_0_0_0,-1,325
102,E,Flame Breath,"Shyvana unleashes a fireball that deals damage to all enemies it encounters and leaves cinders on the target, marking them for 5 seconds. Shyvana's basic attacks on marked targets deal a percentage of their maximum Health as damage on-hit.<br><br><font color='#FF3300'>Dragon Form: </font>Flame Breath explodes on impact or at target location, dealing bonus damage and scorching the earth for a short duration.","Shyvana unleashes a fireball that deals <magicDamage>{{ damagecalc }} magic damage</magicDamage> and marks for {{ markduration }} seconds. The fireball stops on the first champion hit.<br /><br />Shyvana's Attacks against marked targets deal an additional <magicDamage>{{ percenthpdamage*100 }}% max Health magic damage</magicDamage>.<br /><br /><keywordMajor>Dragon Form:</keywordMajor> The fireball explodes once it ends, dealing an additional <magicDamage>{{ dragonexplosioncalc }} magic damage</magicDamage> and scorching the earth, dealing <magicDamage>{{ dragondamagetotalcalc }} magic damage</magicDamage> over 4 seconds.",5,12_11_10_9_8,0_0_0_0_0,-1,925
102,R,Dragon's Descent,Shyvana transforms into a dragon and takes flight to a target location. Enemies along her path take damage and are knocked toward her target location.<br><br>Shyvana passively gains Fury per second and gains 2 Fury on basic attack.,"<spellPassive>Passive: </spellPassive>Shyvana generates <keywordMajor>{{ furygainpertick }} Fury</keywordMajor> every second, and Attacks generate an extra <keywordMajor>{{ furygainonhit }} Fury</keywordMajor>.<br /><br /><spellActive>Active: </spellActive>Shyvana transforms into <keywordMajor>Dragon Form</keywordMajor>, gaining <healing>{{ bonushp }} max Health</healing> and flying forward, dealing <magicDamage>{{ damagecalc }} magic damage</magicDamage> and <status>Knocking</status> enemies toward her target location.",3,0_0_0,0_0_0,-1,850
27,Q,Poison Trail,"Leaves a trail of poison behind Singed, dealing damage to enemies caught in the path.",<toggle>Toggle:</toggle> Singed lays a poisonous trail that deals <magicDamage>{{ damagepersecond }} magic damage</magicDamage> per second.,5,0_0_0_0_0,13_13_13_13_13,-1,20
27,W,Mega Adhesive,"Throws a vial of mega adhesive on the ground, slowing and grounding enemies who walk on it.","Singed hurls a cask of sticky liquid, <status>Grounding</status> and <status>Slowing</status> enemies in the area by {{ e1 }}% for {{ e2 }} seconds.",5,17_16_15_14_13,60_70_80_90_100,-1,1000
27,E,Fling,"Damages target enemy unit and flings them into the air behind Singed. If the target Singed flings lands in his Mega Adhesive, they are also rooted.","Singed flings an enemy over his shoulder, dealing <magicDamage>{{ basedamage }} plus {{ e3 }}% max Health magic damage</magicDamage>.<br /><br />If Singed flings a target into his <spellName>Mega Adhesive</spellName>, they are <status>Rooted</status> for {{ e2 }} seconds.",5,10_9.5_9_8.5_8,60_70_80_90_100,-1,125
27,R,Insanity Potion,"Singed drinks a potent brew of chemicals, granting him increased combat stats, and making his Poison Trail apply Grievous Wounds.","Singed drinks a potent brew of chemicals, granting him {{ statamount }} <scaleAP>Ability Power</scaleAP>, <scaleArmor>Armor</scaleArmor>, <scaleMR>Magic Resist</scaleMR>, <speed>Move Speed</speed>, <healing>Health Regen</healing>, and <scaleMana>Mana Regen</scaleMana> for {{ duration }} seconds. During this effect, Singed's Poison Trail also applies {{ grievousamount*100 }}% Grievous Wounds for {{ grievousduration }} second(s).",3,120_110_100,100_100_100,-1,20
14,Q,Decimating Smash,"Sion charges a powerful swing in an area in front of himself that will deal damage to enemies when released. If he charges for enough time, enemies hit by the swing will also be knocked up and stunned.","<charge>Begin Charging</charge>: Sion charges a heavy blow for up to 2 seconds.<br /><br /><release>Release</release>: Sion slams his axe down, briefly <status>Slowing</status> and dealing between <physicalDamage>{{ mindamagetotal }} and {{ maxdamagetotal }} physical damage</physicalDamage> based on charge time. If Sion charged for at least 1 second, enemies are <status>Knocked Up</status> and <status>Stunned</status> for between 1.25 to 2.25 seconds based on charge time.",5,10_9_8_7_6,45_45_45_45_45,-1,10000
14,W,Soul Furnace,"Sion shields himself and can reactivate after 3 seconds to deal Magic Damage to enemies nearby. When Sion kills enemies, he passively gains maximum Health.","<spellPassive>Passive</spellPassive>: Sion gains {{ e5 }} max Health when he kills a unit, or {{ e6 }} for champion takedowns, large minions and large monsters.<br /><br /><spellActive>Active</spellActive>: Sion gains <shield>{{ totalshield }} Shield</shield> for 6 seconds. After {{ e7 }} seconds if the shield still holds, Sion can <recast>Recast</recast> to detonate the shield to deal <magicDamage>{{ totaldamage }} plus {{ e4 }}% max Health magic damage</magicDamage>",5,15_14_13_12_11,65_70_75_80_85,-1,500
14,E,Roar of the Slayer,"Sion fires a short range shockwave that damages and slows and reduces the Armor of the first enemy hit. If the shockwave hits a minion or monster, it will be knocked back, damaging, slowing, and reducing the Armor of all enemies that it passes through.","Sion fires a shockwave, dealing <magicDamage>{{ totaldamage }} magic damage</magicDamage>, <status>Slowing</status> them by {{ e2 }}% for {{ e8 }} seconds and removing <scaleArmor>{{ e5 }}% Armor</scaleArmor> for {{ e8 }} seconds. Non-champions hit are <status>Knocked Back</status>. Enemies hit by a <status>Knocked Back</status> unit take the same damage and effects.",5,12_11_10_9_8,35_40_45_50_55,-1,800
14,R,Unstoppable Onslaught,"Sion charges in a direction, ramping up speed over time. He can steer his charge slightly with the mouse cursor location. When he collides with an enemy he deals damage and knocks them up based on the distance he has charged.","Sion charges Unstoppably in a direction for 8 seconds, turning towards the mouse cursor. Sion stops on colliding with an enemy champion or wall or on <recast>Recasting</recast> this Ability.  <br /><br />At the end of the charge, Sion deals between <physicalDamage>{{ mindamagetotal }} and {{ maxdamagetotal }} physical damage</physicalDamage> based on distance travelled. Enemies close to Sion are <status>Stunned</status> for between {{ minstunduration }} and {{ maxstunduration }} seconds based on distance travelled. Enemies in a larger area are <status>Slowed</status> by {{ slowamount }}% for 3 seconds",3,140_100_60,100_100_100,-1,7500
15,Q,Boomerang Blade,"Sivir hurls her crossblade like a boomerang, dealing damage each way.","Sivir hurls her crossblade, dealing <physicalDamage>{{ totaldamage }} physical damage</physicalDamage> to all enemies it cuts through before returning, dealing damage a second time. This Ability deals {{ falloffratio*100 }}% less damage per non-champion hit, down to a minimum of {{ falloffminimum*100 }}%.",5,7_7_7_7_7,70_80_90_100_110,-1,1200
15,W,Ricochet,"Sivir's next few basic attacks will bounce to nearby targets, dealing reduced damage to secondary targets.","Sivir's next {{ bounceattacks }} Attacks bounce to nearby enemies, dealing <physicalDamage>{{ firsttargetdamage }} physical damage</physicalDamage> to the initial target and <physicalDamage>{{ bouncedamage }} physical damage</physicalDamage> to each subsequent target.<br /><br />If a given Attack critically strikes its first target, all subsequent bounces from that Attack will also critically strike.",5,12_10.5_9_7.5_6,75_75_75_75_75,-1,20
15,E,Spell Shield,Creates a magical barrier that blocks a single enemy ability cast on Sivir. She receives Mana back if a spell is blocked.,"Sivir creates a magical barrier for {{ e1 }} seconds that blocks the next incoming enemy Ability. If an Ability is blocked by the shield, Sivir regains <scaleMana>{{ e2 }} Mana</scaleMana>.",5,22_19_16_13_10,0_0_0_0_0,-1,20
15,R,On The Hunt,"Sivir leads her allies in battle, granting them a surge Move Speed for a period of time. Additionally passively grants Sivir bonus Attack Speed while Ricochet is active.","<spellPassive>Passive: </spellPassive>Sivir gains <attackSpeed>{{ ricochetattackspeed*100 }}% Attack Speed</attackSpeed> while <spellName>Ricochet</spellName> is active.<br /><br /><spellPassive>Active: </spellPassive>Sivir rallies her allies for {{ ultduration }} seconds, granting all nearby allies <speed>{{ maxms }}% Move Speed</speed> decaying over {{ maxmsduration }} seconds.",3,120_100_80,100_100_100,-1,1000
72,Q,Crystal Slash,"Skarner lashes out with his claws, dealing physical damage to all nearby enemies and charging himself with Crystal Energy for several seconds if a unit is struck. If he casts Crystal Slash again while powered by Crystal Energy, he deals bonus magic damage.","<spellPassive>Passive:</spellPassive> Attacks against champions reduce this Ability's Cooldown by {{ tooltipchampioncdreducer }} second(s). Attacks against minions reduce it by {{ tooltipminioncdreducer }} second(s).<br /><br /><spellActive>Active:</spellActive> Skarner slashes wildly, dealing <physicalDamage>{{ qdamagecalc }} plus {{ qbonusdamage }}% max Health physical damage</physicalDamage> to nearby enemies. If at least one enemy was hit, Skarner becomes charged for {{ e2 }} seconds. While charged, this Ability deals an additional <magicDamage>{{ bonusqdamagecalc }} plus {{ qbonusdamage }}% max Health magic damage</magicDamage>.",5,3.5_3.25_3_2.75_2.5,10_10_10_10_10,-1,350
72,W,Crystalline Exoskeleton,Skarner gains a shield and has increased Movement Speed while the shield persists.,"Skarner gains <shield>{{ totalshield }} Shield</shield> for {{ e4 }} seconds. While active, Skarner gains <speed>{{ e3 }}% Move Speed</speed>, increasing up to <speed>{{ e5 }}% Move Speed</speed> over 3 seconds.",5,13_12.5_12_11.5_11,60_60_60_60_60,-1,1
72,E,Fracture,Skarner summons a blast of crystalline energy which deals damage to enemies struck and slows them. Basic attacking these enemies within a short window will stun them.,"<spellPassive>Passive:</spellPassive> Consuming this Ability's mark or using <spellName>Impale</spellName> reduces this Abilty's Cooldown by the duration of the crowd control.<br /><br /><spellActive>Active:</spellActive> Skarner blasts crystalline energy, dealing <magicDamage>{{ totalmagicdamage }} magic damage</magicDamage>, <status>Slowing</status> by {{ e8 }}% for {{ e7 }} seconds, and marking for {{ e6 }} seconds. Skarner's next Attack against a marked enemy consumes it to deal an additional <physicalDamage>{{ e2 }} physical damage</physicalDamage> and <status>Stun</status> for {{ e3 }} second(s).",5,14_13.5_13_12.5_12,55_55_55_55_55,-1,980
72,R,Impale,"Skarner suppresses an enemy champion and deals damage to it. During this time, Skarner can move freely and will drag his helpless victim around with him. When the effect ends, the target will be dealt additional damage.","Skarner impales an enemy champion, <status>Suppressing</status> them for {{ rduration }} seconds, dealing <physicalDamage>{{ physicaldamage }} physical damage</physicalDamage> and <magicDamage>{{ magicdamage }} magic damage</magicDamage> at the beginning and end of the duration. While <status>Suppressing</status>, Skarner can move and will drag his helpless victim around with him.",3,120_100_80,100_100_100,-1,350
37,Q,Hymn of Valor,"Sona plays the Hymn of Valor, sends out bolts of sound, dealing magic damage to two nearby enemies, prioritizing champions and monsters. Sona gains a temporary aura that grants allies tagged by the zone bonus damage on their next attack against enemies.","Sona deals <magicDamage>{{ totaldamage }} magic damage</magicDamage> to the nearest two enemies, prioritizing champions. She then begins a new <keywordMajor>Melody</keywordMajor>. Gain a stack of <keywordMajor>Accelerando</keywordMajor> for every champion you damage with this.<br /><br /><keywordMajor>Melody:</keywordMajor> Sona gains an aura for {{ auraduration }} seconds, granting allied champions an additional <magicDamage>{{ totalonhitdamage }} magic damage</magicDamage> %i:OnHit% on their next Attack within {{ onhitduration }} seconds.<br /><br /><keywordMajor>Power Chord - Staccato:</keywordMajor> Power Chord bonus damage (<magicDamage>{{ totalstaccatodamage }} total magic damage</magicDamage>).",5,8_8_8_8_8,50_55_60_65_70,-1,825
37,W,Aria of Perseverance,"Sona plays the Aria of Perseverance, sending out protective melodies, healing Sona and a nearby wounded ally. Sona gains a temporary aura that grants allies tagged by the zone a temporary shield.","<spellPassive>Active:</spellPassive> Sona restores <healing>{{ totalheal }} Health</healing> to herself and a nearby allied champion, prioritizing the most wounded. She then begins a new <keywordMajor>Melody</keywordMajor>.<br /><br /><keywordMajor>Melody:</keywordMajor> Sona gains an aura for {{ auraduration }} seconds, granting allied champions <shield>{{ totalshield }} Shield</shield> for {{ shieldduration }} seconds.<br /><br />Gain a stack of <keywordMajor>Accelerando</keywordMajor> whenever you heal another injured ally and every time you protect another ally from at least {{ accelerandoshieldbreakpoint }} damage with this shield.<br /><br /><keywordMajor>Power Chord - Diminuendo:</keywordMajor> Power Chord also reduces physical and magic damage dealt by the target by {{ totaldiminuendoweakenpercent }} for {{ diminuendoduration }} seconds.",5,10_10_10_10_10,80_85_90_95_100,-1,1000
37,E,Song of Celerity,"Sona plays the Song of Celerity, granting nearby allies bonus Movement Speed. Sona gains a temporary aura that grants allied champions tagged by the zone bonus Movement Speed.","<spellPassive>Active:</spellPassive> She begins a new <keywordMajor>Melody</keywordMajor> and grants herself <speed>{{ totalselfmovementspeed }} Move Speed</speed> for {{ selfmovementspeeddurationmin }} seconds, extended to up to {{ selfmovementspeeddurationmax }} seconds if she doesn't take damage. <br /><br /><keywordMajor>Melody:</keywordMajor> Sona gains an aura for {{ auraduration }} seconds that grants allied champions <speed>{{ totalallymovementspeed }} Move Speed</speed> for {{ allymovementspeedduration }} seconds.<br /><br /><keywordMajor>Power Chord - Tempo:</keywordMajor> Power Chord also slows the target's movement speed by {{ totaltempomovespeedslow }} for {{ tempoduration }} seconds.",5,12_12_12_12_12,65_65_65_65_65,-1,430
37,R,Crescendo,"Sona plays her ultimate chord, stunning enemy champions and forcing them to dance and dealing magic damage to them. Each rank reduces the base cooldown of Sona's basic abilities.","Sona strikes an irresistible chord, <status>Stunning</status> enemy for {{ stunduration }} seconds and dealing <magicDamage>{{ totaldamage }} magic damage</magicDamage>.",3,140_120_100,100_100_100,-1,900
16,Q,Starcall,"A star falls from the sky at the target location dealing magic damage and slowing enemies. If an enemy champion is hit by Starcall, Soraka recovers Health.","Soraka calls down a star, dealing <magicDamage>{{ totaldamage }} magic damage</magicDamage> and <status>Slowing</status> by {{ movespeedslow*100 }}% for {{ slowduration }} seconds. <br /><br />Hitting an enemy champion grants Soraka <keywordMajor>Rejuvenation</keywordMajor>, which restores <healing>{{ totalhot }} Health</healing> over {{ hotduration }} seconds and grants <speed>{{ movespeedhaste*100 }}% Move Speed</speed> decaying over the same duration.",5,8_7_6_5_4,45_50_55_60_65,-1,810
16,W,Astral Infusion,Soraka sacrifices a portion of her own health to heal another friendly champion.,"Soraka restores <healing>{{ totalheal }} Health</healing> to another allied champion.<br /><br />If Soraka is affected by <keywordMajor>Rejuvenation</keywordMajor>, the Health cost will be reduced by {{ percenthealthcostrefund*100 }}%, and the target will gain <keywordMajor>Rejuvenation</keywordMajor> for {{ spell.sorakaq:hotduration }} seconds.",5,6_5_4_3_2,40_45_50_55_60,-1,550
