key,ability,ability_name,description,tooltip,maxrank,cooldown,cost,maxammo,range
427,E,Triggerseed,Ivern places a shield on an ally which explodes after a short duration slowing and damaging enemies.,"Ivern grants <shield>{{ totalshield }} Shield</shield> to an ally champion. After 2 seconds, it bursts, dealing <magicDamage>{{ totaldamage }} magic damage</magicDamage> and <status>Slowing</status> enemies by {{ e3 }}% for {{ e4 }} seconds.",5,11_10_9_8_7,70_70_70_70_70,-1,750
427,R,Daisy!,Ivern summons his Sentinel friend Daisy to fight with him. Daisy will send out a shockwave if she attacks the same champion three times in a row.,"Ivern summons his sentinel friend Daisy for {{ f6 }} seconds. If Daisy Attacks the same champion three consecutive times she creates a shockwave, dealing <magicDamage>{{ totaldaisyad }} magic damage</magicDamage> and <status>Knocking Up</status> enemies for 1 second (3s Cooldown).<br /><br />Daisy has:<br /><healing>{{ totaldaisyhp }} Health</healing><br /><scaleArmor>{{ totalbonusresists }} Armor</scaleArmor><br /><scaleMR>{{ totalbonusresists }} Magic Resist</scaleMR><br /><scaleAD>{{ totaldaisyad }} Attack Damage</scaleAD><br /><br /><recast>Recast:</recast> Manually issue orders to Daisy.",3,140_130_120,100_100_100,-1,600
40,Q,Howling Gale,"By creating a localized change in pressure and temperature, Janna is able to create a small storm that grows in size with time. She can activate the spell again to release the storm. On release this storm will fly towards the direction it was cast in, dealing damage and knocking away any enemies in its path.","Janna summons a tornado that grows stronger over {{ e6 }} seconds then blows along its path. It deals <magicDamage>{{ minimumdamage }} magic damage</magicDamage> and <status>Knocks Up</status> for {{ e4 }} seconds. The distance, damage, and <status>Knock Up</status> duration increase based on how much the tornado grew. Janna can <recast>Recast</recast> to send the tornado early.",5,12_12_12_12_12,60_70_80_90_100,-1,1700
40,W,Zephyr,Janna summons an air elemental that passively increases her Move Speed and enables her to pass through units. She may also activate this ability to deal damage and slow an enemy's Move Speed. The passive is lost while this ability is on cooldown.,"<spellPassive>Passive:</spellPassive> While this Ability is available, Janna gains <speed>{{ totalms }}% Move Speed</speed> and is Ghosted.<br /><br /><spellActive>Active:</spellActive> Janna's elemental strikes an enemy, <status>Slowing</status> them by {{ totalslow }}% for {{ e4 }} seconds, and dealing <magicDamage>{{ totaldamage }} magic damage</magicDamage>.",5,8_7.5_7_6.5_6,50_60_70_80_90,-1,550
40,E,Eye Of The Storm,Janna conjures a defensive gale that shields an ally champion or turret from incoming damage and increases their Attack Damage.,"Janna grants an ally champion or turret <shield>{{ totalshield }} Shield</shield> decaying over {{ e3 }} seconds. While shielded, they gain <scaleAD>{{ totalad }} Attack Damage</scaleAD>.<br /><br />Whenever Janna <status>Slows</status> or knocks an enemy champion <status>Airborne</status>, she reduces this Ability's Cooldown by {{ ecdrefundforcc*100 }}%.",5,16_15_14_13_12,70_80_90_100_110,-1,800
40,R,Monsoon,"Janna surrounds herself in a magical storm, throwing enemies back. After the storm has settled, soothing winds heal nearby allies while the ability is active.","Janna summons a magical monsoon, <status>Knocking Back</status> nearby enemies then healing nearby allies for <healing>{{ totalheal }} Health</healing> over {{ e3 }} seconds. Moving or using an Ability ends the monsoon early.",3,150_135_120,100_100_100,-1,725
59,Q,Dragon Strike,"Jarvan IV extends his lance, dealing physical damage and lowering the Armor of enemies in its path. Additionally, this will pull Jarvan to his Demacian Standard, knocking up enemies in his path.","Jarvan extends his lance, dealing <physicalDamage>{{ totaldamage }} physical damage</physicalDamage> and removing <scaleArmor>{{ e2 }}% Armor</scaleArmor> for {{ e3 }} seconds.<br /><br />If the lance connects with <spellName>Demacian Standard</spellName>, Jarvan will pull himself to it, <status>Knocking Up</status> those in his path for 0.75 seconds.",5,10_9_8_7_6,45_50_55_60_65,-1,770
59,W,Golden Aegis,Jarvan IV calls upon the ancient kings of Demacia to shield him from harm and slow surrounding enemies.,"Jarvan summons an aegis, <status>Slowing</status> nearby enemies by {{ e2 }}% for {{ e5 }} seconds and granting him <shield>{{ totalshield }} Shield</shield> for each enemy champion hit.",5,9_9_9_9_9,30_30_30_30_30,-1,625
59,E,Demacian Standard,"Jarvan IV carries the pride of Demacia, passively granting him bonus Attack Speed. Activating Demacian Standard allows Jarvan IV to place a Demacian flag that deals magic damage on impact and grants Attack Speed to nearby allied champions.","<spellPassive>Passive:</spellPassive> Jarvan gains <attackSpeed>{{ permanentattackspeed*100 }}% Attack Speed</attackSpeed>.<br /><br /><spellActive>Active:</spellActive> Jarvan throws a standard into the ground, dealing <magicDamage>{{ totaldamage }} magic damage</magicDamage> and granting allies near the standard <attackSpeed>{{ e3 }}% Attack Speed</attackSpeed> for {{ e4 }} seconds.",5,12_12_12_12_12,55_55_55_55_55,-1,860
59,R,Cataclysm,Jarvan IV heroically leaps into battle at a target with such force that he terraforms the surrounding area to create an arena around them. Nearby enemies are damaged at the moment of impact.,"Jarvan heroically leaps to an enemy Champion, dealing <physicalDamage>{{ damagecalc }} physical damage</physicalDamage> to them and surrounding enemies and creating an arena of impassable terrain around them for {{ wallduration }} seconds.<br /><br />Jarvan can <recast>Recast</recast> to collapse the terrain.",3,120_105_90,100_100_100,-1,650
24,Q,Leap Strike,"Jax leaps toward a unit. If they are an enemy, he strikes them with his weapon.","Jax leaps to a friendly or enemy unit or ward, dealing <physicalDamage>{{ totaldamage }} physical damage</physicalDamage> if it is an enemy.",5,8_7.5_7_6.5_6,65_65_65_65_65,-1,700
24,W,Empower,"Jax charges his weapon with energy, causing his next attack to deal additional damage.","Jax charges his weapon with energy, causing his next Attack or <spellName>Leap Strike</spellName> to deal an additional <magicDamage>{{ totaldamage }} magic damage</magicDamage>.<br /><br /><rules>This Ability triggers spell effects upon dealing damage.</rules>",5,7_6_5_4_3,30_30_30_30_30,-1,300
24,E,Counter Strike,"Jax's combat prowess allows him to dodge all incoming attacks for a short duration and then quickly counterattack, stunning all surrounding enemies.","Jax enters a defensive stance for up to {{ e6 }} seconds, dodging incoming Attacks and taking {{ e3 }}% less damage from area of effect Abilities.<br /><br />After {{ e6 }} seconds or <recast>Recasting</recast>, Jax deals <physicalDamage>{{ totaldamage }} physical damage</physicalDamage> and <status>Stuns</status> nearby enemies for {{ e2 }} second. Deals {{ e5 }}% increased damage for each Attack Jax dodged (max: {{ e4 }}%).",5,14_12.5_11_9.5_8,50_60_70_80_90,-1,300
24,R,Grandmaster's Might,"Every third consecutive attack deals additional Magic Damage. Additionally, Jax can activate this ability to strengthen his resolve, increasing his Armor and Magic Resist for a short duration.","<spellPassive>Passive:</spellPassive> Every third Attack deals an additional <magicDamage>{{ damagecalc }} magic damage</magicDamage>.<br /><br /><spellActive>Active:</spellActive> Jax strengthens his resolve, granting him <scaleArmor>{{ armorcalc }} Armor</scaleArmor> and <scaleMR>{{ mrcalc }} Magic Resist</scaleMR> for {{ activeduration }} seconds.",3,80_80_80,100_100_100,-1,100
126,Q,To the Skies! / Shock Blast,Hammer Stance: Leaps to an enemy dealing physical damage and slowing enemies.<br><br>Cannon Stance: Fires an orb of electricity that detonates upon hitting an enemy (or reaching the end of its path) dealing physical damage to all enemies hit.,"<keywordMajor>Mercury Hammer:</keywordMajor> Jayce leaps to an enemy, dealing <physicalDamage>{{ spell.jaycetotheskies:damage }} physical damage</physicalDamage> to surrounding enemies and <status>Slowing</status> them by {{ spell.jaycetotheskies:slow*-100 }}% for {{ spell.jaycetotheskies:slowduration }} seconds.",6,16_14_12_10_8_6,40_40_40_40_40_40,-1,600
126,W,Lightning Field / Hyper Charge,"Hammer Stance: Passive: Restores Mana per strike. Active: Creates a field of lightning damaging nearby enemies for several seconds.<br><br>Cannon Stance: Gains a burst of energy, increasing Attack Speed to maximum for several attacks.",<keywordMajor>Mercury Hammer - Passive:</keywordMajor> Jayce's <keywordMajor>Hammer</keywordMajor> Attacks grant <scaleMana>{{ spell.jaycestaticfield:managain }} Mana</scaleMana>.<br /><br /><keywordMajor>Mercury Hammer - Active:</keywordMajor> Jayce creates an electric aura dealing <magicDamage>{{ spell.jaycestaticfield:damage }} magic damage</magicDamage> over {{ spell.jaycestaticfield:duration }} seconds.,6,10_10_10_10_10_10,40_40_40_40_40_40,-1,285
126,E,Thundering Blow / Acceleration Gate,"Hammer Stance: Deals magic damage to an enemy and knocks them back a short distance.<br><br>Cannon Stance: Deploys an Acceleration Gate increasing the Move Speed of all allied champions who pass through it. If Shock Blast is fired through the gate the missile speed, range, and damage will increase.","<keywordMajor>Hammer Form</keywordMajor>: Jayce swings his hammer, <status>Knocking Back</status> his target and dealing <magicDamage>{{ spell.jaycethunderingblow:flatdamage }} plus {{ spell.jaycethunderingblow:perchpdamage*100 }}% max Health magic damage</magicDamage>.",6,20_18_16_14_12_10,55_55_55_55_55_55,-1,240
126,R,Mercury Cannon / Mercury Hammer,Hammer Stance: Transforms the Mercury Hammer into the Mercury Cannon gaining new abilities and increased range. The first attack in this form reduces the target's Armor and Magic Resist.<br><br>Cannon Stance: Transforms the Mercury Cannon into the Mercury Hammer gaining new abilities and increasing Armor and Magic Resist. The first attack in this form deals additional magic damage.,"<keywordMajor>Mercury Hammer</keywordMajor>: Jayce transforms his weapon into the <keywordMajor>Mercury Cannon</keywordMajor>, gaining Attack Range and new Abilities. Jayce's next Attack removes <scaleArmor>{{ spell.jaycestancehtg:rangedformshred }} Armor</scaleArmor> and <scaleMR>Magic Resist</scaleMR> for {{ spell.jaycestancehtg:shredduration }} seconds.",1,6,0,-1,600
202,Q,Dancing Grenade,Jhin launches a magical cartridge at an enemy. It can hit up to four targets and gains damage each time it kills.,Jhin launches a cartridge that deals <physicalDamage>{{ totaldamage }} physical damage</physicalDamage> before bouncing to a nearby enemy that has not been hit yet.<br /><br />The cartridge can hit a maximum of {{ tooltipmaxtargetshit }} times. Enemies that die shortly after being hit increase the damage of subsequent hits by {{ percentamponkill*100 }}%.,5,7_6.5_6_5.5_5,40_45_50_55_60,-1,550
202,W,Deadly Flourish,"Jhin brandishes his cane, firing a single shot with incredible range. It pierces through minions and monsters, but stops on the first champion hit. If the target was recently struck by Jhin's allies, lotus traps, or damaged by Jhin, they are rooted.","Jhin fires a long range shot dealing <physicalDamage>{{ totaldamage }} physical damage</physicalDamage> to the first champion hit, and <physicalDamage>{{ totaldamageofftargettooltip }} damage</physicalDamage> to other enemies along the way.<br /><br />If this skill strikes a champion that has been damaged by an allied champion within the last {{ spottingduration }} seconds, it will <status>Root</status> them for {{ rootduration }} second(s) and grant Jhin <spellName>Whisper</spellName>'s Move Speed.",5,12_12_12_12_12,50_60_70_80_90,-1,3000
202,E,Captive Audience,"Jhin places an invisible lotus trap that blooms when walked over. It slows nearby enemies before dealing damage with an explosion of serrated petals. <br><br><font color='#FFFFFF'>Beauty in Death -</font> When Jhin kills an enemy champion, a lotus trap will bloom near their corpse.","<passive>Passive:</passive> Champions Jhin kills will create and detonate a Lotus Trap at their location.<br /><br /><active>Active:</active> Jhin places an invisible Lotus Trap for {{ trapduration }} minutes that creates a zone that <status>Slows</status> by {{ trapslowamount*100 }}% when stepped on by an enemy. After {{ trapdetonationtime }} seconds, the trap detonates, dealing <magicDamage>{{ totaldamage }} magic damage</magicDamage>.<br /><br />This ability has 2 charges ({{ ammorechargeratetooltip }} second refresh).",5,2_2_2_2_2,30_35_40_45_50,2,750
202,R,Curtain Call,"Jhin channels, transforming Whisper into a shoulder-mounted mega-cannon. It is able to fire 4 super shots at extreme range that pierce through minions and monsters, but stop on the first champion impacted. Whisper cripples enemies hit, which slows them and deals execute damage. The 4th shot is perfectly crafted, epically powerful, and guaranteed to critically strike.","Jhin sets up and channels, enabling him to fire 4 super shots, each dealing between <physicalDamage>{{ damagecalc }}</physicalDamage> and <physicalDamage>{{ maxincreasecalc }} physical damage</physicalDamage> to the first champion hit based on their percentage missing health and <status>Slowing</status> them by {{ slowpercent*100 }}% for {{ slowduration }} seconds. The fourth shot critically strikes for {{ fourthshotmultiplier*100 }}% damage.",3,120_105_90,100_100_100,-1,25000
222,Q,Switcheroo!,"Jinx modifies her basic attacks by swapping between Pow-Pow, her minigun and Fishbones, her rocket launcher. Attacks with Pow-Pow grant Attack Speed, while attacks with Fishbones deal area of effect damage, gain increased range, but drain Mana and attack slower.","Jinx swaps weapons between Fishbones the rocket launcher and Pow-Pow the minigun.<br /><br />While using the rocket launcher, Jinx's Attacks deal <physicalDamage>{{ rocketdamage }} physical damage</physicalDamage> to the target and nearby enemies, gain {{ rocketbonusrange }} range, cost Mana, and scale {{ rocketaspdpenalty*100 }}% less with bonus Attack Speed.<br /><br />While using the minigun, Jinx' Attacks grant <attackSpeed>Attack Speed</attackSpeed> for {{ minigunattackspeedduration }} seconds, stacking up to {{ minigunattackspeedstacks }} times (<attackSpeed>+{{ minigunattackspeedmax }}% %i:scaleAS% max</attackSpeed>).",5,0.9_0.9_0.9_0.9_0.9,16_17_18_19_20,-1,600
222,W,Zap!,"Jinx uses Zapper, her shock pistol, to fire a blast that deals damage to the first enemy hit, slowing and revealing it.","Jinx fires a shock blast that deals <physicalDamage>{{ totaldamage }} physical damage</physicalDamage> to the first enemy hit, <status>Slows</status> them by {{ slowpercent }}%, and reveals them for {{ slowduration }} seconds.",5,8_7_6_5_4,50_60_70_80_90,-1,1450
222,E,Flame Chompers!,"Jinx throws out a line of snare grenades that explode after 5 seconds, lighting enemies on fire. Flame Chompers will bite enemy champions who walk over them, rooting them in place.","Jinx tosses out 3 chompers that last for {{ grenadeduration }} seconds. They explode on contact with enemy champions, <status>Rooting</status> them for {{ rootduration }} seconds and dealing <magicDamage>{{ totaldamage }} magic damage</magicDamage> to nearby enemies.",5,24_20.5_17_13.5_10,90_90_90_90_90,-1,925
222,R,Super Mega Death Rocket!,"Jinx fires a super rocket across the map that gains damage as it travels. The rocket will explode upon colliding with an enemy champion, dealing damage to it and surrounding enemies based on their missing Health.","Jinx fires a rocket that explodes on the first enemy champion hit, dealing <physicalDamage>{{ damagefloor }} to {{ damagemax }} + {{ percentdamage }}% missing Health physical damage</physicalDamage>, gaining damage over the first second of travel time. Nearby enemies take {{ aoedamagemult*100 }}% Damage.<br /><br /><rules>Missing Health damage cannot exceed {{ monsterexecutemax }} against Monsters.</rules>",3,75_65_55,100_100_100,-1,25000
145,Q,Icathian Rain,Kai'Sa shoots a swarm of missiles that seek out nearby targets.<br><br>Living Weapon: Icathian Rain is upgraded to shoot more missiles.,"Kai'Sa launches {{ e2 }} missiles that split among nearby enemies, each dealing <physicalDamage>{{ totalindividualmissiledamage }} physical damage</physicalDamage>. Additional hits on champions or jungle monsters deal {{ e3 }}% damage.<br /><br /><keywordMajor>Evolved</keywordMajor>: Kai'Sa instead fires {{ e7 }} missiles.<br />Current: <physicalDamage>{{ spell.kaisapassive:evolutiontrackerq }}/{{ e6 }} Bonus Attack Damage</physicalDamage>",5,10_9_8_7_6,55_55_55_55_55,-1,600
145,W,Void Seeker,"Kai'Sa shoots a long range missile, marking enemies with her passive.<br><br>Living Weapon: Void Seeker is upgraded to apply more passive marks and reduce cooldown on champion hit.","Kai'Sa fires a void blast that deals <magicDamage>{{ totaldamage }} magic damage</magicDamage>, applies {{ e4 }} stacks of <keywordMajor>Plasma</keywordMajor>, and grants <keywordStealth>True Sight</keywordStealth> of the first enemy hit for {{ spell.kaisapassive:pduration }} seconds.<br /><br /><keywordMajor>Evolved</keywordMajor>: Kai'Sa instead applies {{ e5 }} stacks of <keywordMajor>Plasma</keywordMajor> and hitting a champion reduces the Cooldown by {{ e3 }}%.<br />Current: <magicDamage>{{ spell.kaisapassive:evolutiontrackerw }}/{{ e2 }} Ability Power</magicDamage>",5,22_20_18_16_14,55_60_65_70_75,-1,3000
145,E,Supercharge,"Kai'Sa briefly increases her Move Speed, then increases her Attack Speed.<br><br>Living Weapon: Supercharge is upgraded to briefly grant Invisibility.","Kai'Sa supercharges her void energy, gaining <speed>{{ totalmovespeed }} Move Speed</speed> and becoming Ghosted while charging, then gaining <attackSpeed>{{ e5 }}% Attack Speed</attackSpeed> for {{ e2 }} seconds.<br /><br />Attacks reduce this Ability's Cooldown by {{ e4 }} seconds.<br /><br /><keywordMajor>Evolved</keywordMajor>: Kai'Sa also becomes <keywordStealth>Invisible</keywordStealth> for {{ e7 }} seconds.<br />Current: <attackSpeed>{{ spell.kaisapassive:evolutiontrackere }}/{{ e6 }}% Bonus Attack Speed</attackSpeed>",5,16_14.5_13_11.5_10,30_30_30_30_30,-1,1
145,R,Killer Instinct,Kai'Sa dashes near an enemy champion.,Kai'Sa warps near an enemy champion affected by <keywordMajor>Plasma</keywordMajor> and gains <shield>{{ rcalculatedshieldvalue }} Shield</shield> for {{ rshieldduration }} seconds.,3,130_100_70,100_100_100,-1,1500/2250/3000
429,Q,Pierce,Throw a fast moving spear that passes through enemies it kills.,"Kalista hurls a spear, dealing <physicalDamage>{{ totaldamage }} physical damage</physicalDamage> to the first target hit. If this kills the target, the spear continues onward, carrying any <spellName>Rend</spellName> stacks to the next target hit.<br /><br />Kalista can dash after using this Ability using <spellName>Martial Poise</spellName>.",5,8_8_8_8_8,50_55_60_65_70,-1,1150
429,W,Sentinel,"Gain bonus damage when Kalista and her Oathsworn strike the same target. <br><br>Activate to send a soul to scout out the path, revealing the area in front of it.","<spellPassive>Passive:</spellPassive> When Kalista and her <keywordMajor>Oathsworn</keywordMajor> both Attack the same target, she deals <magicDamage>{{ e2 }}% max Health magic damage</magicDamage>. This effect has a {{ e7 }} second Cooldown per target.<br /><br /><spellPassive>Active: </spellPassive>Kalista sends a ghost to patrol an area for three laps. Champions spotted are revealed for 4 seconds. This ability has 2 charges ({{ e4 }} second refresh).",5,30_30_30_30_30,0_0_0_0_0,2,5000
429,E,Rend,"Attacks impale their targets with spears. Activate to rip the spears out, slowing and dealing escalating damage.","<spellPassive>Passive: </spellPassive>Kalista's spears linger in their target for 4 seconds, stacking any number of times.<br /><br /><spellActive>Active:</spellActive> Kalista rips the spears from nearby enemies, dealing <physicalDamage>{{ normaldamage }}</physicalDamage> plus <physicalDamage>{{ additionaldamage }} physical damage</physicalDamage> per spear beyond the first. <status>Slows</status> enemies hit by {{ slowamount*100 }}% for {{ slowduration }} seconds.<br /><br />If this Ability kills at least one target, its Cooldown is refreshed and it refunds <scaleMana>{{ manarefund }} Mana</scaleMana>.",5,0_0_0_0_0,30_30_30_30_30,-1,1000
429,R,Fate's Call,"Kalista teleports the Oathsworn ally to herself. They gain the ability to dash toward a position, knocking enemy champions back.","Kalista puts her <keywordMajor>Oathsworn</keywordMajor> into Stasis and draws them to herself for up to 4 seconds. The <keywordMajor>Oathsworn</keywordMajor> can click to launch themselves, stopping at the first champion hit and <status>Knocking Back</status> all nearby enemies. If the <keywordMajor>Oathsworn</keywordMajor> hits a champion, they are placed at their maximum attack range from it.",3,150_120_90,100_100_100,-1,1000
43,Q,Inner Flame,"Karma sends forth a ball of spirit energy that explodes and deals damage upon hitting an enemy unit.<br><br>Mantra Bonus: In addition to the explosion, Mantra increases the destructive power of her Inner Flame, creating a cataclysm which deals damage after a short delay.","Karma fires a blast of energy, dealing <magicDamage>{{ basedamage }} magic damage</magicDamage> to the first target hit and surrounding enemies, and <status>Slowing</status> them by {{ e2 }}% for {{ e3 }} seconds.",5,9_8_7_6_5,45_45_45_45_45,-1,950
43,W,Focused Resolve,"Karma creates a tether between herself and a targeted enemy, dealing damage and revealing them. If the tether is not broken, the enemy will be rooted and damaged again.<br><br>Mantra Bonus: Karma strengthens the link, healing herself and extending the root duration.","Karma tethers herself to a champion or jungle monster, dealing <magicDamage>{{ initialdamage }} magic damage</magicDamage> and revealing them for 2 seconds. If the tether remains unbroken, the target takes <magicDamage>{{ initialdamage }} damage</magicDamage> again and is <status>Rooted</status> for {{ e2 }} seconds.",5,12_12_12_12_12,50_55_60_65_70,-1,675
43,E,Inspire,"Karma summons a protective shield that absorbs incoming damage and increases the Move Speed of the protected ally.<br><br>Mantra Bonus: Energy radiates out from her target, strengthening the initial shield and applying Inspire to nearby allied champions.",Karma grants an allied champion <shield>{{ totalshield }} Shield</shield> for {{ e4 }} seconds and <speed>{{ e3 }}% Move Speed</speed> for {{ e2 }} seconds.,5,10_9.5_9_8.5_8,50_55_60_65_70,-1,800
43,R,Mantra,Karma empowers her next ability to do an additional effect. Mantra is available at level 1 and does not require a skill point.,"Karma empowers her next Ability used within 8 seconds.<br /><li><spellName>Inner Flame</spellName>: Deals an additional <magicDamage>{{ rqtotalimpactdamage }} magic damage</magicDamage> and leaves behind a circle of flame, <status>Slowing</status> enemies and dealing an additional {{ rqfielddamage }} damage.  <li><spellName>Focused Resolve</spellName>: Karma will restore <healing>{{ rwhealamount }} Health</healing> at the beginning and end of the tether, and <status>Root</status> for {{ rwtotalroot }} second(s) longer.<li><spellName>Inspire</spellName>: Karma shields her target for <shield>{{ rebonusshield }} more Shield</shield>, and also shields allies near her target, granting {{ e9 }}% of the total <shield>Shield</shield> and <speed>Move Speed</speed> value.",4,40_38_36_34,0_0_0_0,-1,1100
30,Q,Lay Waste,"Karthus unleashes a delayed blast at a location, dealing damage to nearby enemies. Deals increased damage to isolated enemies. ","Karthus creates a blast of magic, dealing <magicDamage>{{ qdamage }} magic damage</magicDamage>. If the blast hits only one enemy, it instead deals <magicDamage>{{ qsingletargetdamage }} magic damage</magicDamage>.",5,0_0_0_0_0,20_25_30_35_40,2,875
30,W,Wall of Pain,Karthus creates a passable screen of leeching energy. Any enemy units that walk through the screen have their Movement Speed and Magic Resist reduced for a period.,Karthus creates a wall that lasts for {{ e4 }} seconds. Enemies that pass through lose <scaleMR>{{ e1 }}% Magic Resist</scaleMR> for {{ e5 }} seconds and are <status>Slowed</status> by {{ e3 }}% decaying over the duration.,5,15_15_15_15_15,70_70_70_70_70,-1,1000
30,E,Defile,"Karthus passively steals energy from his victims, gaining Mana on each kill. Alternatively, Karthus can surround himself in the souls of his prey, dealing damage to nearby enemies, but quickly draining his own Mana.","<spellPassive>Passive: </spellPassive>When Karthus kills a unit, he restores <scaleMana>{{ e2 }} Mana</scaleMana>.<br /><br /><toggle>Toggle: </toggle>Karthus creates a necrotic aura, dealing <magicDamage>{{ totaldps }} magic damage</magicDamage> per second to nearby enemies.",5,0.5_0.5_0.5_0.5_0.5,30_42_54_66_78,-1,550
30,R,Requiem,"After channeling for 3 seconds, Karthus deals damage to all enemy champions.","Karthus channels for 3 seconds, then deals <magicDamage>{{ totaldamage }} magic damage</magicDamage> to enemy champions, regardless of distance.",3,200_180_160,100_100_100,-1,10000
